{
  "$schema": "../schemas/run-observation.schema.json",
  "schemaVersion": 1,
  "recordType": "run-observation",
  "collector": { "name": "WHELP Collector", "version": "0.2.0" },
  "game": { "version": "12.1.0", "build": "69587", "interfaceVersion": 120100, "region": "EU" },
  "run": {
    "challengeMapId": 999001,
    "keystoneLevel": 2,
    "affixIds": [],
    "startedAt": 1788300000,
    "completedAt": 1788301200,
    "durationMs": 1200000,
    "deathCount": 1,
    "deathTimeLostMs": 15000,
    "status": "completed"
  },
  "encounters": [
    { "encounterId": 999002, "startedAt": 1788300100, "completedAt": 1788300200, "durationMs": 100000, "success": true }
  ],
  "player": { "classId": 7, "specId": 264, "role": "HEALER", "itemLevel": null },
  "group": [],
  "privacy": { "containsNames": false, "containsChat": false }
}
